"","OBSRVTN_NB","DATETIME_DTM","PNT_NM","QUALIFIER_TXT","PNT_ATRISKNOTES_TX","PNT_ATRISKFOLWUPNTS_TX"
"314",362159,"6/14/2023 15:16","Emergency Action Plan","Location and directions (including maps) to the nearest medical facility, Other - Emergency Action Plan, Reviewed by all employees (EAP)","Once I asked for a WSHP and the crew did not have one to review with me. I asked for a EAP which no plan was available either. I explained that having the WSHP available would help the crew because the WSHP also has an Emergency Action Plan included with it. As it stands now, without the WSHP / EAP. Not even a map is available to assist anyone with getting to the medical facility. The NHPL Safety supervisor is onsite today and I explained that I will speak with him so you can get a Physical copy of the WSHP / EAP to help you in case the crew had a medical Emergancy. It also has addendum C's that cover are work tasks templates to review with the crew before they begin framing out structure arms.",NA
"315",467555,"6/4/2024 9:15","8) Were energy source controls documented on the job briefing?","[Notes Required for At-Risk Conditions]","Scheduled outage box was not checked on the briefing, although all crew members understood that was the situation. [NAME] admittedly was rushing filling it out due to line crew waiting on them.",NA
"316",247846,"6/8/2022 9:14","Drilled Excavations","Fall Protection utilized inside guardrail area","Guardrail system in place but had long conversation regarding the use of the required pins to hold the panels to the bases",NA
"317",196774,"12/13/2021 12:44","Range of Motion","Employee repetitively twisting or reaching beyond a normal range of motion","Employee set up the CNC [NAME] to run the table out to its limit so he did not have to reach out as far to install a cover for machining.",NA
"318",256975,"7/8/2022 10:20","Can the employee identify the 4 reactive forces of the chainsaw in relation to the different areas of the guide bar? (Push, pull, kickback, attack)","[Notes Required for At-Risk Conditions]","Employee could not identify the four force areas of the chain bar, or the actions associated whit any area except for the bar tip.",NA
"319",486651,"8/15/2024 13:00","Qualified observer","Observer engagement","QO was distracted for a little bit and was in conversation with another employee as Line Mechanics were hands on primary. I coached the foreman as to the responsibilities of the QO.",NA
"320",435229,"2/7/2024 13:41","THA","Hazards and Mitigation Controls Identified, Review with each crewmember after lunch and/or significant break in the Work","THA did not have signatures for PM review of work. SIF Icons were not highlighted or identified. Discussed with foreman.","Insure all foreman understand and know the importance of the SIF icons."
"321",230497,"4/18/2022 13:04","PPE - Generation","Use of additional PPE","Winders noted on JSA the chance of electrical shock. They installed danger tape around the unit before testing",NA
"322",412800,"11/14/2023 20:01","THA","THA lists step- by-step plan","After observing the THA, I noticed that there was a task of wrecking out poles using a chain saw. However, there were no control methods on the specific task listed.","Discussed the finding with the foreman and recommended utilizing PPE mitigations to help control the hazard."
"323",345607,"4/6/2023 12:30","Vehicle Set-up Correct","Wheel chocks used","digger truck did not have a wheel chock out, I brought it to their attention and the correction was made",NA
"324",391414,"9/11/2023 11:16","Equipment Operations","Designated Spotter as needed (maintaining adequate clearance)","[NAME] crew member backed up drilling rig inside station with out a spotter. Spoke with supervisor and mentioned to him that everything a piece of equipment moves it has to have a dedicated spotter at all times.",NA
"325",176785,"9/23/2021 13:03","Personal Safety","Line of fire","QO / JLM began setting [NAME] ground as the journeyman in the bucket was drilling a hole in the pool to set a bracket above him. AEP Safety looked over to the foreman and implied if he was going to address this hazard. The foreman looked back at AEP Safety and said oh yeah go ahead and tell him. This was not the first time this bad habit was noted. There was a second time. In addition when the PG safety representative arrived, he too had to communicate to get them out of the line of fire.",NA
"326",332403,"3/21/2023 11:00","THA","Hazards and Mitigation Controls Identified","1. THA Listed Pinch Points But Did Not Identify Any Areas Were Someone Could Get In A Pinch Point Or Caught Between 2. THA Listed Slips Trip & [NAME] But Did Not Identify Any Areas That Would / Could Cause Someone To Slip Trip Or [NAME]","1. Coached The Dacon [NAME] Lead On The [NAME] Completion Of The THA And Identifying Areas The Could / Could Cause A Pinch Point Or Caught Between. 2. Coached The Dacon [NAME] Lead On Identifying Areas That Could / Would Cause Someone To Slip Trip And [NAME] And To Identify The Hazards On The THA Along With The Mitigations For Each [NAME], Site SM Was Also Informed"
"327",30736,"4/21/2020 9:15","Barricades around truck when required","Respect barricade","Did talk to one employee that did not take the barricade down after it could have been, and yet still crossed it.",NA
"328",224894,"3/29/2022 10:36","Continuous Improvement","Expected results are being achieved., Other or I have an idea to improve this work (list in comments), Standard practices is being adhered to","Discussed electrical issue with equipment and unplugging 480v plugsDiscussed electrical issue with equipment and unplugging 480v plugs",NA
"329",351817,"5/17/2023 13:51","Personal Fall Arrest System","Other - Personal Fall Arrest System","Observed a worker temporarily sitting on top of a 8 step ladder. Informed them to utilize the ladder properly.",NA
"330",262903,"7/28/2022 13:54","Fuel Containers and Fuel Storage","Other - Fuel Containers and Fuel Storage","Fire extinguisher no monthly inspection. Spoke to foreman and employee performed monthly inspection.",NA
"331",376275,"7/26/2023 14:30","Equipment Operations","Designated Spotter as needed (maintaining adequate clearance)","Spoke to [NAME] about ensuring more spotters are available when multiple rock trucks are moving in congested work area.","Identified and corrected"
"332",430595,"1/24/2024 15:20","Complete job briefing given (Forestry)","Other - Job Briefing","1 employee arrived late to the jobsite and was not assigned a task and did not sign the job briefing",NA
"333",285469,"10/6/2022 15:49","Rigging Equipment","Inspected prior to use of rigging, Rigging protected from sharp edges","Contractor using 6 ft endless loop slings tied back to the mast of the forklift hold the pipe so that the contractor could pull control cable off. Rigging being used had extensive damage, forklift left unattended with a suspend load, outside the use of the manufactures use for the mast of the forklift. [NAME] photo","Recommend that tag the rigging out of service and to use jacks to pull control cable."
"334",350101,"5/10/2023 11:30","Complete job briefing given (Forestry)","All crew members present during walk through, Communicate understanding of tasks, Specific risks - hazards identified","[NAME] noted the varying terrain for the area, and the multiple hazards that it created. There was a clear description on the briefing, and a in depth discussion of the area.",NA
"335",179251,"10/11/2021 12:22","PPE","Work gloves adequate","One crew member left his leather gloves on different truck but had safety glasses and hard hat, coached employee about bringing all PPE and wearing all PPE",NA
"336",396522,"9/25/2023 11:24","Safe / At-Risk Behaviors Observed","Recognized At-Risk behaviors (In the comment explained how you discussed with the individual and coached them on why it is important)","[NAME] of fork truck pointed out on dock vs approaching delivery truck, and driver standing nearby. Also take into consideration entry speed into RDC truck itself.",NA
"337",365029,"6/18/2023 17:00","Defensive driving","Seat belt","I stopped the employee and ask him to click his seat belt. I introduced myself and told him that I cared about his safety.",NA
"338",333468,"3/16/2023 13:34","Tools and equipment used correctly","Guards used","Found hacksaws that did not have blade covers. Employee made some covers and took care of this promptly",NA
"339",107010,"5/20/2021 11:08","Vehicle Set-up Correct (Forestry)","Vehicle left secured, Wheel chocks used, Wheels turned to curb","vehicle left unsecured with keys on console windows down, bin doors unlocked as well. One wheel chock and tires pointed straight ahead on a down hill slope.",NA
"340",59876,"10/16/2020 7:51","Fire extinguisher inspection up to date and was set off when required","Fire extinguisher on truck","line truck had gloves and sleeves out but forgot fire extinguisher for the linetruck.... bucket truck extinguisher was out",NA
"341",14732,"1/15/2020 8:00","Housekeeping in order (Forestry)","Trash, tools, equipment secured on vehicle","There were loose empty cans of red bull in the bed of the truck. there was also an empty pizza box in a loose 5 gallon bucket in bed of truck.",NA
"342",329315,"3/8/2023 16:00","Minimum PPE","All employees are wearing approved safety glasses w/side shields (ANSI Z87) Motion, All employees wearing at a minimum a hardhat(meets specifications of ANSI Z89.1) Gravity, High visibility reflective shirt/vest worn as the outer most layer (Class 3 where/when required) Motion","Workers not wearing hard hat, proper eye protection, or gloves as required. Only high visibility shirts were worn.","Inspectors and Safety Advisor coached foreman. All workers wore proper PPE."
"343",297871,"11/18/2022 13:00","Crew audit items (Forestry)","ROW equipment/chipper","TRUCK IS MISSING LEVELER TO FLY THE BUCKET. THEY ARE DOING ALL GROUND WORK SO NOT THAT BIG OF AN ISSUE, BUT THIS TRUCK CAME WITH THE LEVELER DAMAGED.",NA
"344",214431,"2/23/2022 13:55","Ergonomics - Generation","Can the task ergonomics be improved, Proper stance","Employees where asked what the MELA was for the task of removing insulation from the 4000V connection ring. They said they needed to raise the part off the floor so it would be right at hand height that way they could have a proper stance plus it would let them move around the part more freely.",NA
"345",426423,"1/6/2024 8:00","Training Requirements","Other - Training Requirements","[NAME] was working on site without a company vehicle. Had crew stand down until company vehicle returned. Onces the vehicle returned we had a little meeting and explained the importance of always having a vehicle on site in case of an emergency.",NA
"346",432685,"1/30/2024 12:24","THA","Hazards and Mitigation Controls Identified","Subcontractor [NAME] Excavating - Job Briefing and THA did not address hazards or mitigation controls for employee exposure to lime during soil stabilization activities. Advised foreman to list health hazards associated with lime ( chemical burns / eye irritation / respiratory exposure ) and list any controls needed i. e. preventing contact with skin, gloves, dust masks, neutralite ( vinegar ) and googles depending on wind conditions.",NA
"347",145471,"1/12/2020 15:25","Complete job briefing given","Other - Job Briefing","[NAME] crews did not have PJBs in trucks. I instructed the service crew to fill out a hand written briefing until they could get copies at their home office.",NA
"348",74342,"1/14/2021 10:00","Aerial Devices - Job Briefing","Were hazards that were eliminated communicated on job briefing?, Were mitigation steps documented?","[NAME] needs to get better about getting detailed with the hazards that were on job and documenting mitigation plan for the hazards.",NA
"349",197006,"12/7/2021 23:09","Ergonomics - Generation","Bend at the knees not back","Coached employees on ergonomics when entering scaffold in tight spaces. Hot pipes in close proximity",NA
"350",61224,"10/22/2020 8:00","Working in MINIMUM APPROACH DISTANCE: - What is the phase to ground minimum approach distance for any exposed energized conductors or equipment at 138 KV when reclosing is disabled?","[Notes Required for At-Risk Conditions]","Opportunity for improvement for the new younger inexperience crew members that are being coached by the NE Supervisor",NA
"351",24094,"3/3/2020 16:47","Workplace Conditions Addressed","Other - Workplace Conditions","[NAME] failed to tell Flaggers the exact work location, so flagging team placed signs in wrong place, crew pulls into lane beside signs and not in between signs in the work zone. Coached on proper communication between Flaggers on the exact work location. Also once the sign package was seen to be out of place crew should have called a stop and had flagging crew re - set sign package",NA
"352",451204,"3/13/2024 13:44","Defensive driving","Changing lanes appropriately, Eye lead time 15 seconds, Headlights on at all times, Maintain 4 second following distance","eminded employee to work on space around vehicle, lights on for safety, and use SMOG when changing lance",NA
"353",314117,"1/13/2023 14:30","Qualified observer","Clear communication, Observer qualifications","QO did not record the critical task at the time they were preformed and good 3 way communication was not observed when performing these steps",NA
"354",167965,"8/6/2021 10:30","Crew has determined that they have the correct PPE to perform job duties safely - (Ask)","[Notes Required for At-Risk Conditions]","Although the correct PPE was listed on the job briefing, two employees were not wearing the correct PPE - safety glasses or hearing protection until they saw me approaching their work site.",NA
"355",136301,"9/1/2021 9:41","PPE","Safety glasses adequate","One employee couldnt find his high vis vest so I provided it to help him out so he would be compliant.",NA
"356",244930,"6/2/2022 15:34","Hand and Power Tools","Pneumatic hose connections secured with cable restraint devices (whip checks)","Whip check needed for hose connection on motorized press; [NAME] coached and hose was replaced with one which has whip check",NA
"357",132763,"8/23/2021 8:23","Fire extinguisher inspection up to date and was set off when required","Other - Fire extinguisher","No annual tag for inspection date Also FE was buried under lots of stuff in back seat and took worker several minutes to find.",NA
"358",465339,"5/24/2024 13:00","Housekeeping in order","Job site hazards","When we exited the vehicle, the customer walked up and I asked him if there were dogs on the premise. [NAME] said the dog is chained up in the back yard. Another person walked out of the garage with a dog. We both had our bite terminator and asked the customer to bring the dog in the house so we can do our work. The customer understood and put the dog up.",NA
"359",476331,"6/21/2024 13:21","Correct PIPE","Other - IPE","Individual not wearing both sleeve straps per manufacturer recommendations. This was discussed with the individual.",NA
"360",205162,"1/19/2022 11:03","Tools and equipment used correctly","Adequate Condition, Correct rigging, Equipment used properly","The lifting sling used to lift recloser was worn on both ends and the lifting capacity couldn't be read. The sling was placed around the device wrong, while lifting. I stopped the team and showed them the proper way to lift, using shackles on the sling ends and where to lift the device safely.",NA
"361",304163,"12/12/2022 11:30","Fall protection used when required (Forestry)","Inspection of body harness / rope","[NAME] snap - hook direct maintenance to remove rust and assess serviceability. [NAME] degradation can interfere with gate opening over time and obscure microfractures.",NA
"362",462461,"5/14/2024 9:09","Vehicle Set-up Correct","Wheel chocks used","wheel chocks no initially put down. Spoke to servicer to the importance and reason for this critical step. Servicer agreed to to make it the first step upon exiting the vehicle.",NA
"363",445972,"3/19/2024 8:36","Job Briefing","Other - Job Briefing","Coached employees on having current adress on briefing not show up location. Employee changed location to current address,",NA
"364",457801,"4/30/2024 9:18","Prior to Moving Load","Pallet integrity inspected","There was no deficiency observed here... I mistakenly clicked on the button and it would not let me validate without selecting a value.",NA
"365",470293,"6/13/2024 10:00","4) Did the crew document a detailed explanation on the work procedures/job tasks for each employee?","[Notes Required for At-Risk Conditions]","[NAME] was using two climbers to block down apple tree with heavy vine growth but the job briefing did not list climbers.",NA
"366",345433,"4/28/2023 10:07","PPE - Workforce","AEP Required (Standard)","A crew member was observed loading straw bales on a trailer not wearing safety glasses, hard hat or high visibility reflective outer layer. A conversation was held with the crew member and he retrieved his PPE out of the truck.",NA
"367",461725,"5/13/2024 14:10","Personal Safety","Line of fire","Made suggestions to employee for trimming tree and keeping himself out of any line of fire hazards from wire under tension or limbs falling.",NA
"368",202467,"1/5/2022 13:20","Tree Felling - Job Briefing","Were mitigation steps documented?","Further information was needed to ensure mitigations techniques necessary to ensure safe and reliable performance while work tasking. Hazards listed were not adequately documented on the job briefing.",NA
"369",384212,"8/18/2023 9:38","Suspended Load/Overhead Work","Drop zones adequately barricaded, Employees protected from overhead loads","Observed missing dropzone around structure where equipment was being hung. Spoke with the supervisor and a drop zone was set up.","Please refer to AEPs Terms and Conditions 10. 4. 3 - Aerial devices shall be barricaded to prevent workers on the ground from falling objects or touching the aerial device in the event of an accidental contact with energized conductors. If the barricade needs to be entered, the observer shall confirm that all work aloft is stopped."
"370",125774,"7/28/2021 8:15","Personal Safety","Eyes on task, Hazard recognition, Mind on Task / Engaged","Employee failed to properly follow procedures along with a disconcerted response when another employee had previously addressed the issues with him.",NA
"371",315846,"1/27/2023 14:17","Personal Protective Grounds","Grounds flagged as required","Noticed a set of grounds that was missing some ground flags. The grounds were near the railroad tracks in the commercial area. Informed [NAME] via text message",NA
"372",206434,"1/20/2022 14:30","Ergonomics - Generation","Can the task ergonomics be improved","Employees assisted with the moving of the vessel, but there may be times where an employee does not have help readily available. There was a discussion about waiting until someone could help, or asking for help from another department. Employees assisted with the moving of the vessel, but there may be times where an employee does not have help readily available. There was a discussion about waiting until someone could help, or asking for help from another department.",NA
"373",128701,"8/10/2021 8:13","Fall Protection (LSR)","Other (LSR)","One contract employee stepped off ladder and was straddling a pipe. Approximately 5 feet off ground. Contractor worked stopped, issue corrected, and their supervisor notified.",NA
"374",265803,"8/4/2022 11:30","Loading/Unloading Procedures","Tires chocked","Observed equipment being unloaded from a load - all trailer. Trailer was on an incline and tires were not chocked. Talked with supervisor about chocking wheels when loading and unloading equipment, especially on an incline",NA
"375",131482,"8/19/2021 10:00","Opportunities To be More Effective","Effective Communication","Since we have ventured into other areas outside of our comfort zone, we need to be aware of others policies and procedures as much a s possible.",NA
"376",368410,"6/27/2023 8:30","Traffic Control","Traffic warning signage in Compliance","Traffic control signage not positioned on colony road curve access / egressing to ROW with vehicles. TCR notified Supt. And Notified NHPL safety rep, and signage installed to warn general public. [NAME] end only missing.","Spot corrected, but continue to monitor placement for general public warnings."
"377",462908,"5/13/2024 11:15","Vehicle Set-up Correct","Wheel chocks used","No wheel chocks on the one bucket truck. DSS was on site and he and I spoke to the crew about this issue to the LCS and the crew.",NA
"378",445084,"3/14/2024 11:10","Live Line Tools and Insulated PPE","All insulated tools/equipment inspected and in good condition","Observed employee in possession of a pair of insulated gloves with an expired dielectric test date, exceeding one year ( see photo ). Additionally, the leather protector was damaged with a visible hole in the thumb area ( see photo ). Advised crew that OSHA standards require insulated gloves to be electrically tested at regular intervals of not more than 6 months. Leather protectors should also be removed from service when they become visibly damaged. I also discussed that many contractors have more stringent requirements for electrical testing, and they must follow their company policy on testing frequency.","Refer to [NAME] River PPE Policy Insulating gloves shall be returned for retesting no later than 120 calendar days and no more than 60 days of field use from the last electrical test date or placed in service date stamped on the gloves. Gloves and sleeves must be removed from use at the end of 120 days from the test date regardless of the issue date."
"379",486275,"8/15/2024 11:13","Correct PIPE","Within of date","One crew member had both stapes of his sleeves to the back, informed his foreman and him the importance of wearing rubber sleeves correctly",NA
"380",82839,"3/2/2021 9:00","PPE","Safety glasses adequate","One of the three flagger were not wearing safety glasses at the time of the observation. Spoke with and addressed to the employee.",NA
"381",437881,"2/20/2024 12:00","Equipment - Setup &Inspection","Equipment set up on level terrain, tires chocked, outriggers fully extended and set on pads - Mechanical","Outrigger pads were not used in an area with soft soil. At one point, the outrigger came up off the ground when picking up a wood pole. Spoke with crew and asked them to use outrigger pads moving forward for better stability.",NA
"382",309907,"1/3/2023 12:00","Did you recognize additional sprain or strain hazards that had not already been recognized and mitigated? If so, please select or describe these hazards in the At-Risk notes.","Hazard recognition","Rigging holding pole in place on ground began sinking into mud, would allow pole to roll into work area.",NA
"383",446368,"3/21/2024 7:34","Personal Fall Arrest System","Other - Personal Fall Arrest System","Hydro vac crew had excavated a trench locating utilities and a hole approximately 3 - 4 feet in diameter and about 6 feet deep. A barricade of caution tape was present around the excavation, however the barricade at one point was directly above the edge of the hole. Additionally fall protection harnesses were not present at the job location.",NA
"384",465251,"5/15/2024 13:00","FR Clothing","FR clothing sleeves down","The bucket worker went aloft with his sleeves rolled up. We coached the employee on having his sleeves down and tucked in his gloves to help prevent flash burns if something went wrong.",NA
"385",301156,"12/1/2022 11:30","Cover up activities","Adequate amount of cover up used, Cover up used when required","[NAME] did not have 2 layers around conductor as it was laying on a different potential. I did coach crew lead and condition was corrected.",NA
"386",417353,"10/6/2023 9:17","Crew audit items (Forestry)","Use of forms","[NAME] did not properly fill out a job briefing that morning. Job briefing was filled out in advance and conditions change all the time.","[NAME] was explained that job briefings must be filled out the same morning and afternoon of work being done."
"387",402247,"10/5/2023 9:30","Policy / Procedure","Do you know how to access policies or procedures and documents related to your job","need to be able to know the process and expectations our Customers should meet when turning in Returns to us.",NA
"388",467611,"5/21/2024 14:30","Equipment used properly within load and operating tolerances","Proper rigging","[NAME] was in the process of hanging a transformer and were utilizing the jib rope hooked back on itself, instead of utilizing a lifting sling. This was discussed and corrected.",NA
"389",414975,"11/20/2023 11:05","Climbing - Procedures","Was a drop zone established, and clearly marked?","* Drop zone had not been established for overhead trimming tasks being performed. Addressed to the foreman and crew to ensure area is properly demarcated at all times while overhead trimming operations are being completed.",NA
"390",8415,"7/22/2019 14:30","Vehicle Set-up Correct (Forestry)","Other - Vehicle Set-up","Passenger outrigger! Left half of outrigger was resting on the top of outrigger pad. GF instructed crew to correct the outrigger placement.",NA
"391",492590,"9/9/2024 9:00","Barricades around truck when required","Fire extinguisher not set off","crew member set up barricade and put out blanket and gloves but forgot to grab the fire extinguisher.","had a discussion about how important it was in case of a fire on or around the truck"
"392",438840,"2/23/2024 8:52","PPE","Safety glasses adequate","Coached employees that while out in the Laydown Yard they needed to wear safety glasses. This was immediately corrected.",NA
